post_num,post_idx,text,topic_tag,sentiment_tag
213,0,אוהדי ב יתר ירושלים ה גזענים מבקשים מ שחקן לשנות את ה שם של הוא כדי להתקבל ל ה קבוצה,0,2
44,2,קובי גדעון,0,2
270,17,כל מה ש צריך להגיד זה לא,0,2
121,11,ערוץ כ ה נ,0,2
70,1,ה חל מ מחר ב ה בוקר,0,2
250,0,אני מעריך את ה עובדה ש שרת ה חוץ של ה איחוד ה אירופי פדריקה מוגריני הסכימה להיפגש עמנו על אף ה לחצים ה אדירים ש הופעלו ל ה ביטול הפגישה,0,2
145,4,אבל הם איבדו את ה אומץ ו עושים רק את ה חישוב ה פוליטי,0,2
193,1,אם אתם רוצים ממשלה ו קואליציה עם אחמד טיבי ו איימן עוד היא אל תצביעו ל ה ליכוד,0,2
269,3,חשף את ה שקר של זכויות מול חובות במשך עשרות שנים,0,2
274,1,פרסום ראשון,0,2
293,10,ש יהיה לכולנו בשורות טובות ו חודש טוב,0,2
223,3,זה מה ש עולה ב צורה מובהקת מ סקר ערוץ 13,0,2
291,18,ש בת שלום,0,2
132,1,ו איתם,0,2
219,19,תודה ל אתה חכ חמד עמאר,0,2
114,27,אנחנו נחושים להוביל ו לנצח ב ה בחירות ה קרובות כדי להחזיר את ה ביטחון ל ה עוטף ע,0,2
87,2,מילה ש נדמה ש כמעט ו איבדה מ ה לגיטימיות של היא ב ה שיח ה ציבורי ו נעדרה מ נאומי מנהיגים רבים ב ה שנים ה אחרונות,0,2
227,5,ה אינטרס של ה ציבור,0,2
140,9,לא יכולים לקנות צעצוע ל ה נכד,0,2
223,9,ו ש פועל על מנת לחסל את ה אפשרות להקים מדינה פלסטינית ו השגת שלום,0,2
218,28,ביטול ה משלוחים ה חיים,0,2
266,5,ליור ה קואליציה דודי אמסלם ש סייע ב ידו,0,2
273,2,הצטרפו אל אני ל עדכון קצר,0,2
114,23,גם שלטון ה חוק נשרף,0,2
216,6,ב בתי ה חולים,0,2
60,7,זאת ב,0,2
252,0,עברית 13,0,2
196,4,בואו ל ה הפגנה ב ה מוצש ה קרוב ב כיכר ה בימה,0,2
191,3,זה מה ש עולה ב צורה מובהקת מ סקר ערוץ 13,0,2
229,4,ו למדתי להכיר מקרוב את תרומתם של בני ה עדה ל ה מדינה,0,2
99,0,קיוויתי ש אקום הבוקר ל נאום ה ניצחון של ה נשיאה ה ראשונה של ארצות ה ברית,0,2
135,6,עיתונים יומיים,0,2
58,1,ירושלים ה מאוחדת היא בירת ה עם ה יהודי כבר אלפי שנים,0,2
283,4,בואו נעשה את זה יחד,0,2
60,0,בושה ו חרפה,0,2
215,4,מ הרי ה גליל ו מ מורדות ה כרמל ירדו לוחמים דרוזים כדי לסייע ב מלחמת ה עצמאות ל מלחמת ה מגן ה יהודית,0,2
26,1,ידידי גון ב ה ולטון,0,2
259,7,לא רק ש זה לא מייצר פיתרון,0,2
250,5,יחד עם זאת,0,2
120,19,גשר יהודית ו דוח ועדת ניסים ב נושא ה גיור ש הוכנס עמוק עמוק לתוך ה מקפיא,0,2
4,0,ישראל תגן על עצמה ב כוחות עצמה,0,2
189,10,ש יקרו ו הכחישו,0,2
272,2,רק לאחר מ כן,0,2
270,6,הם מגיעים ל הכרעת בגץ,0,2
235,21,הוא לדאוג ל כך ש כל אדם יוכל לממש את מלוא ה פוטנציאל של הוא,0,2
125,30,ב מידה רבה מאוד,0,2
66,16,ב כל פעם ש אני נפגש עם אנשי שירות ה חוץ ה ישראלי,0,2
52,2,אם ה פלשתינים ישובו ל ה שולחן ה משא ו מתן ש את הוא נטשו ב אפריל 2014,0,2
120,15,חוק ה גיוס,0,2
222,14,ש לא ילמדו את אנחנו על לאומיות,0,2
136,4,עם ישראל צריך הנהגה חדשה של אנשים ישרים,0,2
213,11,ה הסתה תוביל ל ה רצח,0,2
213,6,ו למנוע השתתפות ה קהל ב ה משחקים של ביתר עד ש יתנצלו ו יחזרו ב ה הם מ דבריהם,0,2
220,0,יקיריי בני ה עדה ה דרוזית נחשף ה פרצוף ה אמיתי,0,2
235,28,ו פועלת ב הגינות ו ב ה סולידריות מתוך ה הבנה ש ה אנשים תחילה,0,2
275,7,כתבה מ וואלה,0,2
173,6,אני ו חברי גאים מאוד להמשיך ב דרכו,0,2
5,36,ל ישראל יש סיפור חזק ו טוב ו אנחנו ידענו ב ה עבר לפעול מול שתי ה מפלגות בלי להיקלע ל ה סכסוכים בין הם,0,2
241,9,בעוד שבועיים יעברו ה 45 ימים ו אם ה ממשלה לא תעלה ל ה הצבעה ב כנסת חוקים אלה,0,2
211,2,פניתי ל ה יועץ ה משפטי ל ה ממשלה ב ה דרישה לפתוח ב חקירה פלילת נגד ראש ה עיר בגין הסתה ל גזענות ו ל אלימות נגד ה אזרחים ה ערבים,0,2
56,0,רק לפני שנה ו חצי ה יינו ב מקום אחר,0,2
167,29,ב ה מקום ל חדרי מיון ו ל הורדת מחירים,0,2
19,6,רועי אברהם,0,2
45,9,קרדיט תמונה,0,2
17,12,צפו ב ה סרטון ה מקסים,0,2
17,3,ל ה משל,0,2
99,15,בעלי מוגבלויות ו בעיקר נשים,0,2
214,0,ל ה היות אזרח,0,2
63,1,כ מי ש גדל ב ה עיר ה זו,0,2
222,6,העברנו חוק על הוספת תאריך עברי ב ה תחליף ה עיקרי ל תעודת ה זהות ה נשלפת ביותר רשיון ה נהיגה,0,2
25,3,ל מי ש שכח,0,2
99,6,פמיניסטית ו מ מובילות ה מאבק למען זכות הצבעה ל נשים,0,2
17,4,ה עולם ה מופלא של ים ה מלח,0,2
142,1,ה סיבה ש לא הגעתי ל ה הצבעה ל פיזור ה כנסת ו גם על ה געגועים ל ה אמא,0,2
215,7,שוב ו שוב נופלים ה הולכים ראשונה ב חוד ה מחנה ו בניכם תמיד עמנו שם שכם אל שכם,0,2
43,12,ה מלים ש לום עולמי נראות ל רגע פחות דמיוניות מתמיד,0,2
114,3,כדי להגיד די,0,2
209,1,מ פלגה חזקה,0,2
127,7,ל ה ישראל ביתנו,0,2
230,0,אחיי ו אחיותייהיום ב שיחת פאנל ב בית ה ספר ב נהלל בפני כיתות יב,0,2
270,19,ש יש ב היא ערכים שמרניים ו ליברלים,0,2
242,9,יהי זכרו ב ה רוך,0,2
221,4,מול ה תכניות של ממשלות ישראל להשתלט על אדמות ה נגב,0,2
212,16,אין שום סיבה ש נאבק גם בתוך אנחנו,0,2
281,2,עוד ב ה מושב ה נוכחי,0,2
272,3,ניתן יהיה לעשות ב הוא שינויים כ כל שיהיו מקובלים על כל ראשי ה מפלגות ו בראש ו בראשונה על ידי ראש ה ממשלה,0,2
22,6,דבריי ב ה ערוץ ה כנ,0,2
256,9,צפו ב ה נאום ה מלא של אני כעת ב ה מליאה,0,2
287,4,הפיכת ה מדינה ה יהודית ו ה דמוקרטית ל מדינת כל אזרחיה,0,2
14,4,כי מה ש היה צריך לקרות מזמן,0,2
39,2,רודי גוליאני,0,2
59,2,אין שום רווח ביטחוני ב כך,0,2
140,10,הגיע ה זמן לשנות את ה משוואה כש ה כלכלה מזנקת למעלה אסור להפקיר את הם מאחור,0,2
259,1,ל ה פני ה כל,0,2
109,9,מתוך ה עולם ה בוקר,0,2
189,8,הזהרתי מ זה כבר אתמול ו אז תומכי ה מפלגה של הם,0,2
42,8,ה פתרון ה יחיד הוא פתרון של פשרה ו חלוקה,0,2
195,28,ל מי ש חרד ל עתידה של ה מדינה גם מ בחינה בטחונית,0,2
174,2,לא ידענו,0,2
211,3,הקשיבו ל מה ש אמר חכ עופר כ ה סיף ב ה סרטון,0,2
134,18,פשוט לכו אל ה קלפי ו הצביעו מחל,0,2
92,34,כדי להיאבק על עצם ה זכות להיאבק,0,2
42,9,פתרון שתי ה מדינות ל שני ה עמים,0,2
134,3,יותר משההתבטאות של הוא הרתיחה,0,2
102,7,רק כיפת ברזל חברתית,0,2
82,1,אמרתי ש אני מעריך ש ל צערי ה פעם ה שגרירות לא תעבור ל ה ירושלים,0,2
25,5,כל עוד נתעלם מ שגרת ה בלונים,0,2
257,1,ערבים ו יהודים,0,2
299,9,ספק אם ניתן להמשיך ו להצדיק היותנו מדינה יהודית ו דמוקרטית,0,2
92,14,דמעות זולגות על ל חיי פסל ה חירות,0,2
219,17,עובדי חברת חשמל ו ב תחומים נוספים,0,2
43,11,התחייבות של קים ל ה התפרקות מוחלטת מנשק גרעיני,0,2
134,15,אם אתם בטוחים ש אתם רוצים ממשלת ימין לאומית,0,2
271,1,30 לפנות בוקר,0,2
87,10,יש כאן הזדמנות ל הסדר אזורי ו שלום עם ש כ נינו,0,2
189,2,ראיתם את ה סקרים אתמול ב ה ערב,0,2
221,8,יחי יום ה אדמה,0,2
16,10,סגן ה נשיא המשיך ו אמר ב החלטתו,0,2
25,6,ה התפרעויות ו ה מרגמות ב ה עוטף,0,2
101,0,שידור חי,0,2
164,1,כך זה נראה ב ה ימים ה אחרונים,0,2
134,11,ה שר ה זה צריך להתנצל עוד היום ו גם לזכור ש ה אחריות על מערכת ה משפט הייתה נתונה בידי מ פלגתו,0,2
210,8,אזרחי ה מדינה ה יהודים ו ה ערבים,0,2
219,24,פשוט איש ה פועל ו ה מעשה,0,2
167,39,אלא מ סיבות ערכיות,0,2
144,6,ו כ ה מובן,0,2
127,16,נקום מחרתיים ב ה בוקר עם שיר חדש ב ה ,0,2
245,7,אפשר לתאם את אנחנו מפגשים נוספים ו נחזור ב ה הקדם,0,2
134,9,את ה פילוג ו ה מפריד ב עמנו,0,2
119,3,מה עוד אתם צריכים לדעת על מה ש עומד בפני אנחנו ב ה בחירות ה א,0,2
176,3,אבל נעמוד על ה אינטרסים ש ל אנחנו,0,2
236,6,צפו ב ה ראיון,0,2
120,18,אבל ה סמל ה זה כולל בתוך הוא חרם צרכני על מפעל פיניציה ב ברכת ה אדמור מ גור,0,2
175,9,420 מיליון שח הבטחת הכנסה ל ה אברכים,0,2
251,2,עוד נאבק ב כל ה חזיתות,0,2
125,32,ב ה יתר ש את ב שעות אחר ה צהריים של יום ה בחירות,0,2
265,0,ב ה זמן ש ישנתם,0,2
93,13,אך לעיתים ה דרך ב היא היא מועברת חשובה לא פחות,0,2
102,8,ה תכנית ה כלכלית של ה עבודה גשר,0,2
175,10,ככה לא מנהלים מדינה,0,2
2,3,ה שמאל אמנם ימשיך ל ה פמפם את ה שקר ו ה נרטיב ה פלסטיני על שטחים כבושים דמיוניים,0,2
235,8,ה גמלאים,0,2
65,8,ה תקשורת ה ישראלית חיה ב ה בועה,0,2
172,8,היא ה אלטרנטיבה ש תעשה את מדינת ישראל חזקה כי מדינת ישראל ש לנו תהיה מדינה עם שוויון ש תחתור ל ה שלום,0,2
23,1,ב ה פגישה עם גייסון גרינבלט,0,2
34,4,רועי אברהם,0,2
240,6,ו זה הכי רחוק ש יש מ צביון יהודי,0,2
87,7,מי היה מאמין,0,2
216,3,אבל אנחנו כאן,0,2
19,0,מדינת ישראל דוחה על ה סף את החלטת ה אום,0,2
191,7,הוציא מ חוץ ל ה חוק את ה פלג ה צפוני של ה תנועה ה איסלאמית,0,2
10,11,ב ה ערב ה זה אזרחי ישראל כולם,0,2
66,8,ה מדיניות ה רוסית לא השתנתה ב ה סנטימטר,0,2
133,6,ב ה מחיר של בומרנג מדיני ב ה טווח ה אר,0,2
25,7,כך נמצא את הם רודפים את אנחנו ו הופכים את כל ישראל לעוטף עזה,0,2
121,6,1 מליון ישראלים הם מצפים מאת אנחנו ו ב ה צדק,0,2
162,3,תנחומים ל משפחת ה הרוג ו איחולי החלמה ל ה פצועים ש נאבקים על חייהם,0,2
92,17,משהו ב ין איתן ברושי לחכ ממוצע ביש עתיד,0,2
7,6,צילום מסך מת,0,2
174,6,ארץ ישראל ב סכנה אמיתית של חלוקה,0,2
52,3,נדע לעמוד על משמר ה אינטרסים ש לנו ו להדוף כל תכתיב או לחץ,0,2
269,0,עכשיו בירכא ה אהובה,0,2
47,6,היום אחדש את פנייתי ל וועדת ה כנסת כדי ש ניתן יהיה לשלול שכר מ חבורת תומכי ה טרור ש יושבת ב ה כנסת יש,0,2
279,0,מדינת ישראל תקיים שוויון זכויות חברתי ו מדיני גמור ל כל אזרחיה בלי ה בדל דת,0,2
223,13,ה קול ש מצליח להשפיע,0,2
7,1,אשף ב הנהגת אבו מ אזן הוא ארגון ש מעודד טרור דרך הזרמת משכורות עתק ל ה מחבלים רוצחים,0,2
278,10,אני מצדיע ל תושבי לוד ש המשיכו ב תפילת ה חג,0,2
167,18,ל ה מפלגות ו אפילו ישירות ל ה פוליטיקאים,0,2
174,4,לא תיארנו ש כך יהיה,0,2
218,0,ב ה דרך ל השבעת ה כנסת ה 21,0,2
170,8,אותן שיטות,0,2
173,0,לשבת ב ה מרכז בגין ב ה ירושלים,0,2
59,1,לקיחת אחריות משמעותה לתקוע אצבע ב ה עין ל ה אויב ו להניע את הוא ל ה תגובה,0,2
10,4,סיפקנו נתונים ו פעלנו בגלוי ו ב חשאי,0,2
57,5,ש בת ש,0,2
122,2,מותם גבורה,0,2
29,4,לא ל ה הסכם,0,2
217,5,אני אשיב ל הוא ב 11,0,2
210,13,תקרום עור ו גידים ו תהיה מורגשת ב כל צעד,0,2
34,3,הגיע ה זמן,0,2
259,17,לשבת על ה מדוכה עד ש יימצא הפיתרון ש אינו צבאי,0,2
167,24,20 מיליארד,0,2
237,3,זו השפעה חשובה,0,2
42,18,כי אני מגדל פה נכדים ו דואג ל עתידם ב ה מקום ה,0,2
208,8,זכותנו לבנות על ה אדמות ה פרטיות ש ל אנחנו,0,2
5,35,אפשר לטפל ב ה זה,0,2
226,9,או ל ה ימים ב ה הם ל ה הטבים נשארו ב ה ארון כדי לא להרגיז,0,2
33,1,היום מפורסם כי אובאמה השתיק מהלך ל עצירת חזבאללה ו שליחיו מ להבריח סמים ל ארהב רק כדי ש זה לא יפגע ב הסכם ה גרעין ה גרוע ש אל הוא הגיע עם מדינת ה טרור איראן,0,2
167,26,יוקר ה מחיה הוא ה בעיה מס 1 של אזרחי ישראל,0,2
177,5,ו ב ה יתר ש את,0,2
256,3,אהבת ה מולדת,0,2
103,2,000 איש ב ה בת ים,0,2
11,4,כולל ה שותפות ה אחרות ל ה הסכם ש לא פרשו מן אנחנו,0,2
191,12,ה קול ה מקצועי,0,2
167,9,שר ה חינוך ה מיועד,0,2
175,0,ב ה רוכים ה באים ל ה מציאות,0,2
204,0,72 מ ה אזרחים ה ערבים תומכים ב הצהרות של אני ב ידיעות אחרונות,0,2
5,31,צריך לשים לב ל ה שאלה על איזה דמוקרטים מדובר,0,2
47,2,פניתי ל ועדת ה כנסת ל שינוי תקנון ש יאפשר שלילת שכר מ חכים מתפרעים כ ה דוגמת ה ביזיון ש ביזו ה חכים ה ערבים היום את הכנסת,0,2
235,25,מ משלה ש אינה דואגת ל זכויות ה בסיסיות ביותר של אזרחיה אינה ראויה לשרת את הם,0,2
71,2,ניר שרף,0,2
175,14,יותם פישביין,0,2
279,20,את קולו של מי רצו להשתיק,0,2
132,3,הוכחה נחרצת ל כך ש כל פתק אל הוא,0,2
113,10,אנחנו לא קצוות,0,2
17,6,ה תרבות ו ה ספורט של הכנסת,0,2
218,15,פנינו ל ה יועץ ה משפטי ל ה ממשלה נגד ה ניסיונות להכניס ל ה מומ ה קואליציוני את ענייניו ה משפטיים של ראש ה ממשלה,0,2
204,13,נגיע ל מיליון מצביעים ו נעשה את זה ביחד,0,2
125,14,היו ש חששו להגיד זאת ב קול רם,0,2
48,3,זה ה מקום ש יאחד את ה אנושות כולה ו זה ה מקום מן אנחנו יכולים לצמוח שיתופי פעולה רבים,0,2
14,0,נפגשתי היום ב יוסטון עם מזכיר ה אנרגיה ה אמריקאי,0,2
1,6,מ חוייביםלריבונ,0,2
231,5,ל ה כן,0,2
212,3,ב ה מבט לאחור,0,2
99,17,ו מאמינה ב ה שוויון ל כל,0,2
223,11,ה קול ה אחראי,0,2
177,13,דלגו ל ימינו אלה,0,2
117,12,לא נופלים ל ה ספינים,0,2
210,15,מטמרה ו מ בית גן,0,2
17,0,ל ה מזלנו,0,2
297,3,כש ב ה פעם ה באה יובא חוק ל עצירת ה מסתננים ל ה בגצ,0,2
144,0,ניצחון ענק ל ה קואליציה ש לנו ב בחירת מבקר ה מדינה,0,2
218,12,מ רצ חוזרת היום ל כ נסת,0,2
30,1,נפגשתי אז גם עם שגריר ארהב ל ה מועצה כדי לקרוא ל פרישה מיידית של ארהב מ ה מוסד ה מקולקל ה זה,0,2
267,7,מתוך ה דיון היום על חוק ה פונדקאות,0,2
235,18,לא ל מאבק ה אדם נולד,0,2
119,1,כי הוא מסייע ל ה מחבלים ל הרוג יהודים,0,2
176,4,מדי פעם עולות יוזמות,0,2
139,0,ה ביקור של גייסון גרינבלט,0,2
257,0,אלפי מפגינים ב ה תא,0,2
108,5,לא תהיה החלפה ו לא תהיה רוטצ,0,2
218,30,אנחנו פה להיאבק,0,2
279,5,ב ה רגע ה זה,0,2
93,10,אני כן מאמין ב יכולתנו ל ה תקן ו להשתפר,0,2
111,3,משלבים תבונה מדינית יחד עם עמידה על עקרונות בסיסיים של צדקת ה דרך,0,2
287,2,איום על ה ביטחון,0,2
189,5,יש כבר רוב חוסם של 61 חכים,0,2
301,4,כבוד ה אדם ו חירותו מעגן את אופייה ה דמוקרטי של מדינת ישראל,0,2
194,0,חברות ו חברים יקרים,0,2
93,5,סוף ה דמוקרטיה,0,2
175,12,אנחנו כבר הוכחנו התנהלות אחרת,0,2
61,0,צעדים חד צדדיים מחסלים את ה סיכוי ל תהליך מדיני,0,2
94,0,הרבה יותר נשים ו גברים היו אתמול ב ה הפגנה למען שוויון ו נגד סקסיזם ו גזענות מאשר גברים ו נשים ש היו שלשום,0,2
100,7,ש בת שלום,0,2
112,2,כש זה מצטרף ל ויתור על גיוס חרדים ו קביעה ש רק אנחנו נהיה ה פראיירים ש משרתים ב ה צבא,0,2
112,8,שליברמן הציל את אנחנו מ להפוך ל מדינת עולם שלישי,0,2
230,1,על ה חברה ה ישראלית,0,2
222,13,ב ה קיצור,0,2
221,2,ו לא רק היסטורית,0,2
205,2,עכשיו עוד היא מוכן ל שותפות ו מציג את ה מחירים ש ישראל תשלם אם זה יקרה,0,2
270,0,כש זנדברג ו סמוטריץ יוצאים נגד כנראה ש אנחנו עושים משהו נכון,0,2
282,2,חוק ה עמותות זוכים ל השוואה ל ה גרמניה ה נאצית על ידי הרצה את היא ב ה אוניברסיטה ה עברית ש מגבה את הוא,0,2
33,0,מ משל אובאמה יצר נזק עצום ל ארהב ו בעלות בריתה בשל מדיניות חוץ מנותקת ו שגויה,0,2
92,33,הצטרפות ל שמאל זה אולי ה דבר ה חשוב ביותר ש אפשר לעשות היום,0,2
150,5,ו יגיע גם ל בתי ה מש,0,2
85,3,לטעון ש ל ה פלשתינים אין קשר ל ה פיגועים ו לפעמים סתם להשחיר את משטרת ישראל,0,2
117,11,אנחנו מגיעים ל ה בחירות ה אלה ב כל ה כוח,0,2
262,4,ה לשון ה עברית ו ה לשון ה ערבית תהיינה שוות ב זכויותיהן ו ב ה תוקפן ה חוקי,0,2
92,39,הצטרפו אל אני,0,2
235,0,ממשלת ה מאבק ב ה אזרח,0,2
235,1,ב ה שנים ה אחרונות היינו עדים ל עשרות מאבקים ב רחובות ה נכים,0,2
38,5,שום דבר מ זה לא קרה ו ה שמיים לא נפלו,0,2
173,4,בגין היה מנהיג גדול ש יצר שיוויון ו חוזק כלפי פנים ו עוצמה ו הרתעה כלפי חוץ,0,2
17,10,יחד עם אמנים מ רחבי ה עולם,0,2
244,0,לפי ה סקר ה אחרון של ערוץ 10,0,2
226,11,מרצ ידעה לנער את ה שמרנות ו להאבק על ישראל כמו ש ה ישראלים רוצים,0,2
94,4,גם הרבה יותר שלושה מיליון יותר,0,2
13,0,אני מברך על הכרזתו של נשיא צכיה על העברת ה שגרירות ה צכית לירושלים,0,2
271,0,ה שעה עכשיו 01,0,2
93,12,ביקורת היא דבר חשוב,0,2
290,0,אני שומע את ה קולות ש עולים נגד ה החלטה ש ל אנחנו להוציא את ה פלג ה צפוני של ה תנועה ה אסלאמית אל מ חוץ ל ה חוק,0,2
111,2,מדיניות כלכלית ליברלית של הסרת חסמים ו הגברת תחרות ב ה משק,0,2
174,5,נכון ל היום,0,2
285,5,צפו ו שתפו,0,2
175,13,סגרנו את ה בור ה תקציבי ו השארנו אחרי אנחנו עודף תקציבי ל ה ממשלה ה באה,0,2
218,16,נאבקנו ב דיכוי ה הצבעה ב ה חברה ה ערבית,0,2
246,2,סגן יור הכנסת חכ חמד עמאר,0,2
217,2,מ ה צד ה אחד אהרון ברק,0,2
169,3,שם אין עיכובים ו אין דחיות,0,2
114,18,לא יכול להיות ש מדינת ישראל תזלזל ב ריבונות של עצמה,0,2
285,2,מדינת ישראל היא ה בית ה לאומי ל ה עם ה יהודי עם זה הם לא מסכימים,0,2
9,5,אין ספק ש לאור החלטות בעלות משמעות ביטחונית כמו אלה,0,2
134,8,ה יום ה מסמל מ כל את שנאת ה חינם,0,2
115,6,מספיק עם ה בלופים ש ל אתה,0,2
250,11,ו אנו מלאי מרץ ו שכנוע ו נחישות להמשיך,0,2
222,0,ישבתי אתמול על ספסלי בית ה משפט ה עליון,0,2
291,0,זו ה שורה ה תחתונה,0,2
270,5,כש לא מתמודדים עם הכרעות ב נושאים חשובים ב כ נסת,0,2
99,9,פחות מ 100 שנה אחרי,0,2
43,16,ו אלה היו מריעים ל אובאמה על את הוא צעד ב ה דיוק,0,2
99,10,מאות נשים ש מימשו את זכות הצבעתן עיטרו את קברה ב מדבקות ש עליהם רשום הצבעתי היום ו ציינו את ה מהפכה ה גדולה ש אנחנו עדיין ב שיאה,0,2
42,16,אני חולם ו אופטימי כי אני פטריוט,0,2
156,2,מדובר ב ה מפלגה ה סובלת מ מחסור חמור ב ה אידאולוגיה ו קובץ של הבטחות סרק,0,2
114,2,ל ה עוטף,0,2
233,2,אני מכבד את עברו ה צבאי של גנץ ו קצת פחות מתרשם מ הבנתו ב משפט חוקתי,0,2
95,18,ה בחירות הסתיימו,0,2
12,4,ה דרך תהיה ארוכה ו אנו עלולים לשלם מחיר אך יש ל אנחנו בעל ברית רב עוצמה ב ה דרכנו להחזיר את ה שד ה איראני ל ה בקבוק,0,2
194,3,אל תושפעו מ ה כותרות ה מהדהדות ו ה זועקות ב כלי ה תקשורת,0,2
235,15,היא נאבקתם ב זכותם ל ה בטחון,0,2
116,7,באנו לשרת את אתם מתוך אמונה ש אפשר לעשות זאת ב יושר,0,2
29,5,חס ו חלילה,0,2
279,22,אם אנחנו מצהירים,0,2
84,6,ל אתם ו ל ה משפחותיכם,0,2
241,7,חוק זכויות ו חוק העדפה ל יוצאי צבא,0,2
132,2,אמור לחתום ליברמן על ה סכם עודפים,0,2
242,8,ה לב דואב,0,2
167,17,ל מקורבים פוליטיים,0,2
202,5,ו יש כ ה אלה,0,2
30,3,ו מחזק את מילותיה של ה שגרירה ניקי היילי,0,2
131,2,צפו ו שת,0,2
64,3,כדי ש ה שלום ישכון ב ה ארץ ה שלום,0,2
36,1,ימינה חזקה היא ה דרך ה יחידה ל הקמת ממשלת ימין,0,2
262,2,אני יודע זאת,0,2
145,0,מדינת ישראל נמצאת ב ה סחרור,0,2
64,2,מעל צריחי ה מסגדים ו מגדלי ה כנסיות,0,2
125,12,ב שיחות ה טלפון ו ב מפגשים אקראיים את ה רצון ש ל אתם,0,2
10,7,אסור ש ל איראן תהיה יכולת טילית בליסטית ארוכת טווח,0,2
290,4,מדינת ה לאום של ה עם ה יהודי,0,2
208,9,זכותנו לחיות ב ה כבוד,0,2
99,24,אין ספק ש בחירתה של אישה ב ה פעם ה ראשונה ל נשיאות ארהב הייתה יכולה להיות רגע מכונן ב ה מהפכה ה פמיניסטית אך אני בטוחה ש נגיע ל כך ב עתיד,0,2
105,5,בלי קיזוזים ו בלי ה נחות,0,2
81,6,ישראל לעולם לא תסכים ל חלוקת ירושלים,0,2
270,7,ו זה לא בריא,0,2
5,37,אלא ש זה לא יכול לקרות בלי עבודה מקצועית ראויה,0,2
232,19,הצהרה היסטורית ש ביקשה ל בנות מדינה,0,2
93,11,ל דבר אחד עם ה שני ב צורה תרבותית בלי לפגוע ב ה מזיד,0,2
294,9,בדיוק בשביל זה יש הליך פרלמנטרי מסודר ו ארוך,0,2
212,11,ב ה עיניי,0,2
13,7,מפעילים תוכנית בינלאומית נרחבת ל שיפור מעמדה ה בינלאומי של ירושלים,0,2
170,9,אותן אמירות,0,2
259,21,פרטים ב ה תגובה ה ראשונה,0,2
