post_num,post_idx,text,topic_tag,sentiment_tag
176,5,ה אחרונה ש ב הן היתה של גון קרי ו מי ש נשכב אז על ה גדר כדי ש לא נפנה את בקעת ה ירדן זה אני,0,2
299,1,כאילו ש יחסי ה יהודים ערבים בישראל ב ימים אלו לא מספיק מתוחים,0,2
38,7,כמו ש אתם רואים,0,2
100,0,השבוע התקבלה החלטה מ ה חשובות ל ה בטחון ישראל,0,2
150,4,זה יהיה מאבק משולב של ה כנסת ו של ה רחוב,0,2
186,1,זוכרים ש לאחר ה רצח ה נורא של אורי אנסבכר זל,0,2
92,8,או יותר נכון היעדרה,0,2
19,9,ל ה ,0,2
167,34,את זה אנחנו נחושים לשנות,0,2
99,21,מה הייתה אומרת סוזן ב,0,2
270,20,מסורתיים ו חילונים,0,2
76,0,בלמעלה מ 30 שנות היכרותי עם ה אום,0,2
138,0,ה מדינה ב ה משבר מנהיגות,0,2
222,16,אדריאן סבל,0,2
10,6,אסור ש ל איראן תהיה יכולת גרעינית צבאית,0,2
118,9,ש תציל את ה מדינה מ ה התנהלות ה מופקרת,0,2
99,5,ב ה שבוע ה אחרון מאות נשים עלו ל קברה של סוזן ב,0,2
5,13,אמרה ל אני על דרמר חברת קונגרס דמוקרטית משפיעה במיוחד,0,2
223,1,נתניהו ו שריו ה גזענים היו מפסידים,0,2
167,30,הוא הולך ל מטרות פוליטיות,0,2
28,1,ה אפקט של ה סנקציות ה ראשוניות כבר מורגש ה ריאל ב ה שפל,0,2
182,1,בן ארי יקרא ל ה סירוב פקודה,0,2
226,2,ו עכשיו צריך לדבר על איך זה ייראה,0,2
278,2,התפרץ ל תפילת ה חג כדי למנוע מ ה מתפללים לקיים את מצוות ה חג ו להתפלל,0,2
201,1,אז מסתבר ש היה גם היה,0,2
92,35,ו לא פחות חשוב על ה דרך ש ל אנחנו,0,2
114,9,ש מישהו זלזל ב ה הם לצערי כבר לפני שנה,0,2
10,9,אני גאה ב גורמי ה ביטחון ש נטלו חלק ב ה מאמצים ה אדירים הללו ל אורך שנים ש הייתה ל אני ה זכות לקחת ב הם חלק ו אף להוביל,0,2
273,0,נוסע כעת ל כ נסת,0,2
122,1,חייהם מ לחמה,0,2
293,7,הצעת חוק ה מחייבת נוכחות נציג ממשלה ב ה הלוויה או ב ניחום אבלים של חלל כוחות ה ביטחון ו ה הצלה,0,2
219,2,כל ה אמת על חכ חמד עמאר,0,2
291,9,מדובר ב קמפיין גזעני,0,2
190,3,ו בהינתן ה תכנית ל הקמת פלסטין,0,2
108,2,בשל ה תקפות ה תקשורת,0,2
80,11,שער ה עיתון דר ש פיגל מ נובמבר 2016,0,2
177,6,ב עת כהונתו כ ראש ה ממשלה ה שמאל לא בחל ב שום אמצעי כדי להשמיצו ו לגדפו,0,2
135,7,ערכות פנאי ו ביקורים אחת ל ה שבועיים,0,2
298,5,לכן תמיד ל עקרון ה דמוקרטיה יש יתרון על עיקרון ה מדינה ה יהודית,0,2
24,3,מנהרת ה רכבת ה מהירה ל ירושלים תימשך מ תחנת נבון עד ל פאתי ה עיר ה עתיקה ו שם תוקם ה תח,0,2
147,2,פה זה לא טורקיה,0,2
136,2,מ רצ,0,2
130,1,תושבי ה דרום הם כולם פשוט ימשיכו ל שעמם את ה ממשלה ה זאת,0,2
207,0,ערב טוב הערב התקיימה וועידת מפלגת ישראל ביתנו ב ראשות יור ה מפלגה ו שר ה ביטחון לשעבר אביגדור ליברמן ו ב מהלכה הוצגה ה רשימה של ה מפלגה ל כ נסת ה 22 ו ב היא שובצתי ב ה מקום ה שישי,0,2
137,2,חייבים להמשיך לפעול ל ה איחוד כל ה גורמים מ שמאל לכחול לבן,0,2
256,0,הי זאת של אני,0,2
170,7,שאליו הם מתגעגעים,0,2
14,9,ה מזכיר פרי בירך על ה התקדמות ב פיתוח שדות ה גז ה טבעי ב ישראל,0,2
219,10,מי ש מכיר את חמד יודע ש הוא לא יאכזב ו לא ימכור דברי סרק,0,2
235,22,ו לדאוג ל כך ש כל אחד ו אחת יגיעו ל מחוז חפצם ב ה כבוד,0,2
114,6,ו תראו את ה דוגמא של ה שדה מאחורי,0,2
16,22,למעט המשך ה שקר ה לבן ו ה מוכר,0,2
51,6,מן ה ראוי ש כך גם אנחנו נפעל ו נהיה קצת יותר נדיבים,0,2
167,2,איך זה קשור,0,2
279,10,יהודית ו יחד עם זאת מתייחסת ב ה שוויון ב כל אזרחיה,0,2
47,3,לא קיבלו אז את הצעתי,0,2
115,1,אהוד ברק על מי בדיוק אתה מנסה לעבוד,0,2
31,5,לישראל ו קוריאה ה דרומית הרבה ב משותף,0,2
226,10,מרצ בגדולתה ידעה להמריץ את מפלגת ה שלטון ל ה הישגים חסרי תקדים,0,2
177,2,השבוע נציין את יום ה שנה ה 27 ל פטירתו של גדול מנהיגנו,0,2
5,40,לא כש ה מדיניות מוכתבת מ שיקולים קואליציוניים ו מ ה פחד מ ה סיעות ה חרדיות ב ה מקום מ מה ש טוב ל מדינת ישר,0,2
218,5,קואליציית חסינות משחיתות תמורת סיפוח כבר ב ה פעולה,0,2
199,1,אינם תחליף ל ה הרשעה ב מדינה דמוקרטית,0,2
25,9,כדאי לבחון את תוצאות ה התנתקות ה קוד,0,2
27,4,ל ה ,0,2
224,4,אנחנו רק יודעים ש אתם בעד הקמת מדינה פלסטינית ו חניקת ה התיישבות ביוש,0,2
229,6,חובת כולנו לחזק את ה ברית ה זאת אף יותר,0,2
249,1,ו איזו שנה,0,2
18,0,ישראל דוחה על ה סף את ה החלטה ה מגוחכת ב ה אום,0,2
8,9,בן פרץ,0,2
85,6,אנא שתפו,0,2
10,14,אין ל אני ספק ש נוכל ל הוא כ חברה ו כ ה מדי,0,2
92,16,מדובר ב פוליטיקאי מרכזי ו ממסדי,0,2
218,17,ב ה גזענות,0,2
172,5,תודה ל אתה על ה דברים ה אמיצים ש כל אזרחית ו אזרח ב ישראל חייבים לקרוא את הם,0,2
225,2,יש הזדמנות ל ה שינוי,0,2
189,12,יש מספרים,0,2
122,4,בני ה משפחות,0,2
114,19,בין אם זה רקטה ו בין אם זה בלון או עפיפון,0,2
189,18,מי ש רוצה ממשלת שמאל,0,2
276,10,הרגשתי סיפוק רב מ ה חום ו ה תמיכה ש קיבלתי מ ה ציבור,0,2
39,0,צפו ב ה קטע מתוך תוכנית ה חדשות ה נצפית ביותר ב ארהב,0,2
220,8,אחים ש ל אנחנו ו עודבמקביל חלק גדול מ חברי הכנסת של ה מחנה ה ציוני הצביעו נגד,0,2
56,1,ש ב כל הזדמנות טרח לתקוע את מדינת ישראל ו להפקירה מול כל ה עולם,0,2
210,6,כפי ש מגיע ל כל אזרח ב ה מדינה זאת משימה את היא אני אשלים,0,2
219,20,ה קמה ו מיסוד תנועות נוער דרוזיות ש מונות לא פחות מ 18,0,2
232,26,ש היא אינה ציונית,0,2
282,3,זה גם את הוא אחד ש כינה את שרת ה משפטים איילת שקד טינופת נאו נאצית,0,2
235,14,היא נאבקת ב זכותם ל ה שוויון,0,2
45,11,ה קרן לרווחה ל נפגעי ה שואה ב ה יש,0,2
92,36,על ה ערכים,0,2
58,4,על איומי ה פלשתינים ו תומכיהם אנחנו אומרים לעולם מ מתי איומי אלימות קובעים מדיניות,0,2
244,4,כמה מכשולים עברנו,0,2
12,5,אבי אוחיון,0,2
66,7,אבל בני ש יחנו ב ה ממשל ו ב ה פרלמנט ה רוסי הבהירו ל אנחנו,0,2
214,13,אבל גם אם לא תעשו שום דבר מ ה דברים ה אלה,0,2
80,7,צמיחה בת קיימא היא מפתח ל כלכלה חזקה,0,2
62,6,ל כל ה טרוריסטים ש מנסים להלך על אנחנו אימים אני מוסר מ כאן לא תפחידו את אנחנו,0,2
287,6,מגיעה היום חכ סלימאן ו מסירה את הוא,0,2
50,3,ש יהיה ברור,0,2
14,12,ה צפוי לצאת ב מהלך ה קיץ ה קרוב,0,2
204,4,הקמת עיר ערבית ראשונה,0,2
75,4,צריך להסביר ש יש דברים ש הם אינטרס לאומי עליון כמו בנייה ב ה חברון,0,2
122,7,ש השפעתה על מדינתנו היא מהבולטות ש ב מלחמת ה עצמא,0,2
185,1,שמחתי לפגוש גם ב בית ספר חילוני תומכים נלהבים של תנועת שס,0,2
84,7,שבוע טוב,0,2
285,4,ה אם נשאר שם משהו ציוני,0,2
6,7,לא תתקיים ריבונות נוספת חוץ מישראל בין ה ים ל ירדן ו אל תתנו ל אף אחד לבלבל את א,0,2
113,9,אנחנו ימין רציונלי ו מ רכז שפוי,0,2
61,6,לא ל חינם הלך ה זרזיר אצל ה עורב,0,2
219,4,ב תמיכת ה מפלגה אל היא הוא משתייך,0,2
14,15,כי ב כוונתו להגיע ל ביקור ב ישראל עוד הש,0,2
269,1,לרגל יום ה אדמה,0,2
215,6,כבר 71 שנה ש אנו קוברים את ילדינו ב מאבק ה מגן ש אין רואים את סופו,0,2
29,8,צריך מנהיג ש יודע להוביל מהלכים ל טובת ה אינטרס ה ישראלי,0,2
170,4,אתם חושבים ו מרגישים ש זה ממש מ ה יום,0,2
177,7,ו על ידי כך להביא ל הפלת ה ליכוד,0,2
223,4,ה בחירות ב אפריל עומדות על חודו של קול,0,2
170,2,אנחנו מבוהלים,0,2
259,6,עפיפונים ב ה מציאות של סגר ו משבר הומניטרי ב ה עזה,0,2
167,25,מ איפה אתם חושבים ש ה כסף ה זה יגיע,0,2
18,1,ירושלים היא בירתנו תמיד הייתה,0,2
226,20,יש ל אנחנו פחות מ חמישים ימים צריך לתת לתת את ה נשמה ו לא לעצור עד ה סוף,0,2
214,9,תשאלו שאלות,0,2
110,4,ה ציבור ש ל אנחנו שייך ו בעל מודעות גבוהה,0,2
102,4,ב ה עלי עסקים,0,2
77,0,ב ה שידור חי,0,2
214,17,תעשו טוב,0,2
297,8,בוקר טוב ישראל,0,2
189,14,ל ה כן יקיריי,0,2
249,4,הכנסת מצליחה אזרחי ישראל מצליחים,0,2
177,8,הם קראו ל הוא רוצח,0,2
66,10,שנשארת רחוקה ו מנותקת,0,2
270,22,כדאי לעצור רגע ו לברך על זה,0,2
270,8,לא ל ה בגץ ו לא ל ה כנסת,0,2
284,5,הם שוללים את היותה של ישראל ה בית ה לאומי של ה עם ה יהודי,0,2
174,3,לא חשבנו,0,2
142,2,ה כל בראיון ל ה מקור ראש,0,2
245,3,מ שיחה פתוחה על ה סוגיות ה פוליטיות ש מעניינות את הם,0,2
59,12,כדי להחזיר את ישראל ל ה מס,0,2
223,0,לו ה בחירות היו מתקיימות היום,0,2
237,7,ב ביטחון מלא,0,2
177,3,מנחם בגין זל,0,2
9,11,כולנו עם א,0,2
125,8,שמענו ב ה קניונים,0,2
61,2,אבל היא גם עיר ה בירה של ה מדינה ה פלסטינית ה עתידית,0,2
134,6,לא כל ש כן,0,2
47,4,ל הוא היתה מתקבלת אני בטוח ש ה חכים ה ערבים לא היו מעיזים להתפרע,0,2
99,25,עצם ה התמודדות של אישה לעמוד ב ראש ה מעצמה ה עולמית הוא ניצחון,0,2
256,1,אתם יודעים מה ה הבדל בין לאומיות ל ה לאומנות,0,2
208,0,היה ל אני ה כבוד ה ערב להתארח ב ביתו של אחינו אבו עלאא יוסף כ נעאן ב כפר ירכא ל חוג בית לקראת ה בחירות ה קרובות,0,2
235,24,בשביל מה היא קיימת אם לא לשם כך,0,2
129,4,ו את קהילת ה מודיעין ו כוחות ה בטחון על מאמציהם ה רבים ש הביאו ל איתורו ו השבתו ארצה,0,2
190,5,ו זה יעמוד על ה פרק,0,2
223,14,אנחנו יכולים,0,2
251,4,כמו ש ה ראשונים התגברו על ה ממשל ה צבאי,0,2
256,6,שנאת ה אחר,0,2
241,6,ו עוד שני חוקים,0,2
219,1,ב ל אני מעצורים,0,2
38,4,ב ה פועל,0,2
185,2,אשר זוכרים את ה הישגים ה ברוכים ש הובלנו למען ה שכבות ה חלשות ו ה צביון ה יהודי של ישראל,0,2
256,2,לאומיות היא אהבת ה ארץ,0,2
125,25,ל עיתים קרובות,0,2
94,3,ו זה לא קרה סתם,0,2
245,0,את ה בוקר הקדשתי כדי להיפגש עם תלמידי תיכון פורדיס,0,2
191,11,ה קול ה אחראי,0,2
132,5,עוד פחות מחודש מחליטים,0,2
60,3,ה שמאל ישיג 61 מושבים ב ה כנסת ה באה יהיה ראש ה ממשלה של אתם ב עוד פחות מ שנתיים,0,2
120,6,זה לא ב ה מקרה ש ב ה פעם ה ראשונה מ אז קום ה מדינה,0,2
172,7,שרבין היה ראש ה ממשלה מטעם היא,0,2
192,1,זה היה נכון מ מזמן,0,2
7,2,מפיץ הסתה נגד מדינת ישראל ב מערכת ה חינוך ו ב תקשורת ה פלסטינית ו פועל ב כל ה כח נגד אנחנו ב ה זירה ה בינלאומית,0,2
226,4,אבל הוא חייב לצד הוא מ רצ ברורה ו חזקה,0,2
168,3,אני מצפה מ ה ציבור,0,2
14,10,ו על ייצוא ה גז מ ישראל ל ה מצרים,0,2
219,7,אבל כש הוא מבטיח הוא מקיים,0,2
128,1,הרבה מפלגות,0,2
298,4,ל עקרון ה מדינה דמוקרטית משום שחוק חופש ה ביטוי ו חוק כבוד ה אדם מעוגנים כ חוקי יסוד ו אילו ה מדינה ה יהודית לא מוגדרת כ חוק יסוד,0,2
177,0,מה אנחנו ל ה מדים ב בחירות ה אלה,0,2
114,7,אנחנו משלמים ל הוא פרוטקשן,0,2
280,3,יש כאן מבחן אישי גדול מאוד ל כל חבר כ נסת,0,2
244,3,זה רק אחד מ ה ישיגנו,0,2
65,7,מרגישים מחוברים ל ה ארץ ו תורמים רבות ל פיתוחה,0,2
65,4,באתי לחזק ו יצאתי מחוזקת,0,2
181,0,מיכאל בן ארי קורא ל סירוב פקודה ו פוגע ב ה צבא של כולנו ש הוא יהיה חבר ממשלה,0,2
177,4,כל חייו,0,2
282,4,ל ה מישהו יש עוד ספק למה ה אקדמיה הביאה על עצמה את ה צורך ב ה קוד ה אתי,0,2
232,20,לא לפרק את היא,0,2
18,3,אבל אני מעריך את ה עובדה ש מספר הולך ו גדל של מדינות סירבו להשתתף ב תיאטרון ה אבסורד ה זה,0,2
244,10,מנסים להחליש את אנחנו,0,2
92,10,אצל אנחנו ראשי מפלגות ה אופוזיציה ה מרכזיות מתקרנפים,0,2
12,2,תעשיית ה שקר ה איראנית ניסתה לחפות על תעשיית ה גרעין,0,2
125,5,המצאות ו שקרים נוראיים,0,2
74,2,את בחירתו של מחבל עם דם על ה ידיים ל תפקיד ראש ה עיר ה גדולה ביותר ב ה רשות ה פלסטינית,0,2
218,20,נמצאות הצעות חוק יסוד זכויות חברתיות,0,2
25,8,רגע לפני ש ה שמאל מוציא ל ה דרך התנתקות 2,0,2
51,8,נעשה כל ש ב יכולתנו על מנת לעצור את ה חלטה ה אלימה ו ה אטומה ה זו של משרד ה פ,0,2
134,7,ב ה מהלך תשעה ב ה אב,0,2
269,4,ה אדמות של כולנו הופקעו,0,2
163,1,לפיד ו גנץ שמאל,0,2
170,1,אנחנו לא ישנים ב ה לילות,0,2
109,10,רשת ,0,2
81,1,מקומן של כל ה שגרירויות הוא ב ה בירתנו ירושלים,0,2
58,5,מי ש נכנע ל אלימות רק מעודד את ה טרור,0,2
281,3,ה נסיונות של מערכת ה משפט לבלום את השבת ישראל ל מסלול יהודי ו ציוני יותר,0,2
78,3,רוני זינגר,0,2
194,8,האזינו ל ה ראיון ה מלא ש הענקתי הבוקר ל ניסים משעל ב ה רדיו ללא הפסקה,0,2
136,1,למרות כל ה חיבורים ה אלה מ שמאל פרץ,0,2
16,24,של משא ו מתן לשם משא ו מתן ו תו לא,0,2
125,34,יש עוד הרבה מה לכתוב,0,2
281,4,לא יצליחו,0,2
196,5,ו ב כל רחבי ה ארץ,0,2
66,19,אבל ש יהיה ברור,0,2
66,1,ו לא בגלל ה טמפרטורה,0,2
100,3,צפו ב ה דברים ש אמרתי ב ה נושאים ה אלה ל,0,2
134,10,ש הביא לפני קצת פחות מ 2000 שנה ל פיזורנו ל כל עבר,0,2
219,18,ו לכן אחוז ה משתלבים ב יחס ל כמות ה דרוזים ב ה ארץ הנו גבוה,0,2
189,11,אבל אופס,0,2
280,4,אבל יש כאן מבחן אישי משמעותי גם ל אתם,0,2
5,17,גם על ה קרע ה מתמשך עם יהדות ארהב אנחנו הולכים לשלם מחיר,0,2
250,2,הייתה פגישה חשובה,0,2
189,3,ל גוש ה שמאל,0,2
17,11,משתתפים ב ה שימור מ רחבי ה טבע ש שייכים ל ה כולנו,0,2
104,5,מוזמנים להאז,0,2
148,7,אנחנו נמשיך לתת גיבוי מלא ל ה יועמש ל ה ממשלה,0,2
229,3,לחמתי עם אחיי ה דרוזים כתף אל כתף ל אורך שנים ו גם פקדתי עליהם,0,2
85,7,כדי לעזור ל אנחנו לפוגג את ה פייק ניוז,0,2
175,15,ידיעות אחרונות,0,2
244,11,אבל אנו מוכיחים את כוחנו ו את נוכחותנו,0,2
114,26,כ חול לבן מציעה אלטרנטיבה בטחונית ו כלכלית,0,2
14,3,ו פרי השיב,0,2
148,10,ו רק שאלה קטנה נותרת איפה כל אלו ב ה ליכוד ש דיברו כל ה שנים ב שם שלטון ה חוק,0,2
24,2,ב יום ה עצמאות ה קרוב נכריז רשמית על שם ה תחנה,0,2
189,19,ב תמיכת ה סיעות ה ערביות ש יצביע ל מפלגות ה שמאל,0,2
205,0,מהיום זה ברור יותר מ אי פעם,0,2
218,6,ו מ צריכה אופוזיציה לוחמת,0,2
235,7,נגד ה כיבוש,0,2
34,7,ל ה ,0,2
13,8,ו אין ספק ש תהליך העברת ה שגרירויות ה זרות לירושלים הוא צעד חשוב ב ה מאבק על ה מעמד של ירושלים כבירת מדינת ה יהודים ל אורך ה דור,0,2
212,13,לא משרת אף אחד ב שום מצב,0,2
250,7,מ כאן,0,2
70,4,לאחר חתימת ה הסכם,0,2
177,19,משום אין ל הם שום אלטרנטיבה ו שום רעיון משותף,0,2
124,2,צפו ו שת,0,2
249,7,על מנת ש ב ה שנה ה באה עלינו ל ה טובה ה חיים של אזרחי ישראל יהיו עוד יותר טובים,0,2
226,7,ו למען ה דמוקרטיה ה ישראלית,0,2
168,5,עוד מדבריי ל ה טל של הוא,0,2
19,2,ירושלים היא בירתנו ו נמשיך ל ה בנות ב היא,0,2
251,0,ב ה דרך ל ה איחוד ה אירופי ב ה בריסל,0,2
62,1,אני נמצא כעת ב ביקור מדיני ב בירת ה איחוד ה אירופי בריסל,0,2
216,1,כל הצלחה ל יישוב ערבי או לאזרח היא גם ניצחון על ה גזענות ו ה הדרה,0,2
94,6,והייתה אצילית ו מ ה ממת ב ה לבן ב טקס ה השבעה,0,2
156,4,לא יעזרו חנופות ו קריצות,0,2
175,3,הנה לפני אתם רשימה חלקית,0,2
214,16,תהיו טובים,0,2
215,1,מילותינו צרות מ להכיל את הוקרתנו ל תרומתה ה אדירה ו ה נאמנה של ה עדה ה דרוזית כולה,0,2
31,2,ל ה איומים ב נשק גרעיני מ איראן או קוריאה ה צפונית אין מקום ב ה עולם ה מערבי,0,2
164,3,נלך אל ה קלפיות,0,2
31,6,שתיהן מדינות מתפתחות ו חדשניות ש מאוימות ב נשק גרעיני,0,2
279,9,נקבע גם אופיה של מדינת ישראל,0,2
92,13,אולי זה בגלל ש הם עצמם בטוחים ש הם לא כ ה אלה,0,2
270,23,אמיר אוחנה אבי דיכטר יריב לוין,0,2
143,5,ככה זה לא יכול להמש,0,2
287,0,כל ה תורה ב ה שני ציוצים,0,2
213,1,אנו לא חוששים על ה שם מוחמד,0,2
231,11,כ ה חברה,0,2
26,4,לעולם לא ניסוג מ רמת הגולן ו חשוב ש כל ה מדינות יכירו ב ריבונותה של ישראל ב רמת ה גו,0,2
99,2,איחלתי ל אנחנו ש נזכה לראות שחר של יום חדש,0,2
93,4,ב מסגרתו ה יד קצרה על ה הדק ב שימוש ב מושגים כמו פשיזם,0,2
113,15,תודה ל דוד בן ב סט ה מראיין על עוד ארוח נפלא ב תחנת ה רדיו של הוא,0,2
51,0,הגענו היום ל אירוע שבת פיליפינית נגד ה גירוש כדי להגיד לא ל ה גירוש של ילדים ש נולדו פה,0,2
131,1,אנחנו כאן בשביל להילחם על ה נושאים ש חשובים ל כולנו באמת ו אין ל אנחנו כל כוונה להתפשר על הם,0,2
19,1,עוד לפני ש התקבלה,0,2
137,0,אני מברכת את יור מרצ ניצן הורוביץ על ה מהלך של הגדלת ה מחנה ה דמוקרטי ב הובלתה ה אידיאולוגית של מרצ ו ב ה התאחדות סביב היא,0,2
216,5,ב ה תעשייה,0,2
267,3,פתיחת מושב ה קיץ היום מעיד על המשכו,0,2
5,32,כמו ה שמאל ה אירופי,0,2
170,5,אז זהו ש לא,0,2
85,1,תעשיית ה פייק ניוז מ תוצרת ערד ניר עובדת סביב ה שעון,0,2
262,7,דברים ש נשאתי היום ב מליאת הכנסת,0,2
120,0,מחיר ה יוהרה,0,2
163,0,לפיד ו גנץ תמכו ב הסכם ה גרעין ה מסוכן עם איראן,0,2
232,12,אנשים הוגנים,0,2
235,26,ה בחירות ה קרובות הן ה הזדמנות ש ל אנחנו להחליף את ממשלת ה מאבק ב ה אזרח ו להקים מ משלה ש משרתת את הוא מ משלה ש שמה את ה אדם ב ה מרכז,0,2
99,18,קלינטון נתנה את מאבק חייה ו בתור אישה אין ספק ש היא שברה את תקרת ה זכוכית,0,2
128,2,הרבה נבחרי ציבור,0,2
78,5,ש השיקו את ה פרוייקט ה מקסים ש ב מסגרתו משווקת חולצות כמו זו ש אני לובשת כאן ב תמונה,0,2
249,6,לחזק את חברי ה כנסת ו לתת ל הם כלים נוספים,0,2
125,6,מול אנרגיות אדירות ש איימו לשטוף את כל הישגינו ב ה עשור ה אחרון ו להעלות ממשלת שמאל,0,2
89,10,ב שורה תחתונה אל תאמינו ל מה ש מספרים ל אתם,0,2
134,1,מיותר ו מביך לצטט כאן מדברי שר ב ה ממשלה,0,2
136,5,לפני ה חדש,0,2
125,17,ו אכן,0,2
84,0,מול שלושה חברי כנסת מ ה שמאל,0,2
251,3,ו זו רק ה התחלה,0,2
116,6,ה בוחרות ו ה בוחרים,0,2
141,1,ל ה מה,0,2
218,2,לא נעלה תמונות סלפי מחויכות מ ה מליאה,0,2
9,8,נכון לקחת את הן,0,2
17,13,ש בת שלום,0,2
134,4,היא פשוט הביכה,0,2
282,1,חוק ה הסדרה,0,2
117,6,ראשי מפלגות כמו רפי פרץ,0,2
279,4,ב עת ה חתימה על מגילת ה עצמאות,0,2
193,7,אין ל ה הם מ משל היא,0,2
137,4,שוויון ו דמוקרט,0,2
237,4,ה דיאלוג עם ה קהל ה יהודי חשוב,0,2
23,4,דנו ב איומי איראן,0,2
235,19,ה אדם נולד על מנת להרבות שמחה ו להמעיט כאב,0,2
226,1,מ אתמול ב ה בוקר יש סיכוי אמיתי להציג חלופה ל ממשלת ליכוד כהנא חי ו לייצר תקווה ל ה ממשלה אחרת,0,2
197,4,ב יחד יכולים,0,2
114,24,ה כלכלה נפגעת,0,2
48,1,נפגשתי עם משלחת ראשי פרלמנטרים מ אפריקה ו לקחתי את הם ל מגדל דוד כי כאן ה כל התחיל,0,2
299,10,ה דמוקרטיה ה יחידה ב ה מזהת,0,2
226,0,אתמול ב ה בוקר ה מרכז התאחד ו נפל דבר,0,2
245,2,אין מספק ו משמח יותר עבור אנחנו ב ה רשימה ה משותפת מ מפגש עם בני נוער,0,2
215,0,ב ה חלקה ה צבאית ל ה חללים ה דרוזים ב שפרעם,0,2
170,6,זוהי תעמולה של ה שמאל מ בחירות 1981 ו ראש ה ממשלה היה אהובם ה גדול מ נחם בגין,0,2
29,7,בשביל לשנות את ה מציאות צריך מנהיגות,0,2
259,12,צריך רק לבחור ב דרך אחרת,0,2
210,0,היום התחלנו את קמפיין ה שותפות של אנחנו,0,2
167,28,יקר פה כל כך מפני ש ה כסף הולך ל ה מקומות ה לא נכונים,0,2
80,8,כלכלה ש עובדת ב שירות בני ה אדם ו לא להפך,0,2
109,8,צפו ו שתפו את ה אמת,0,2
214,10,תנקטו עמדה,0,2
134,12,ו שרה מ רשימתו,0,2
92,27,זאת ה מדינה של הם ו אין ל הם כוונה לוותר ל רגע אלא להמשיך ו להיאבק על ה דרך,0,2
63,0,ירושלים היתה ו תישאר בירתו של ה עם ה יהודי ו ב ה ירתה של מדינת ישראל לנצח על אפם ו חמתם של כל ה מתנגדים ו ה מאיימים ב אלימות,0,2
259,14,מתווה ל הקלות הומניטריות ו שיקום ה רצועה במקום סגירת מעברים ו הכבדת ה סגר,0,2
