post_num,post_idx,text,topic_tag,sentiment_tag
95,13,התבטאויות נגד בעלי מוגבלויות,1,-1
95,14,מוסלמים ו מיעוטים נוספים היו אקורד ה ניצחון של הוא,1,-1
95,15,דיווחים מ ארהב מספרים ש ה מציאות ב ה רחובות השתנתה תקיפות,0,2
95,16,גילויי אנטישמיות ו שאר סיפורים מזעזעים,0,2
95,17,ה מבטאים יותר מ כל את אובדן ה מוסר,0,2
95,18,ה בחירות הסתיימו,0,2
95,19,מ ה יום יש נשיא ארצות ה ברית חדש,1,0
95,20,מותר ו צריך להביע סולידריות עם מחאת ה נשים ב ה ארהב,1,-1
95,21,תמיכה נשית ו אחווה אמיתית בין אנחנו אוהבי ה אדם,0,2
95,22,ה מאמינים ב זכויות ה אדם ו ב ה כבוד ל כל איש ו אישה,0,2
96,0,ה נשיא ה נבחר טראמפ,1,0
96,1,תודה ל אתה על ה ידידות ה חמה ו על תמיכתך ה חד משמעית ב ה ישראל,1,1
97,0,ב רכות ל נשיא ה נבחר של ארצות ה ברית,1,1
97,1,דונלד טראמפ,1,0
97,2,ארצות ה ברית היא ידידתה ה גדולה ביותר של ישראל,1,1
97,3,ו אני בטוח ש ה נשיא טראמפ ימשיך ב ה דרך ש סללו קדם את הוא,1,1
98,0,אני מברך את ה נשיא ה נבחר של ארהב,1,1
98,1,דונאלד טראמפ,1,0
98,2,ו מאחל ל הוא הצלחה גדולה,1,1
98,3,אנו נמשיך,0,2
98,4,יחד עם ה נשיא ה חדש,1,0
98,5,לשמור ו לחזק את ה קשר ה מיוחד ו ה ידידות ה אמיצה בין ה מדינות ו נפעל לחזק את ה ערכים ה משותפים ל ה ישראל ו ל ה ארהב,1,1
99,0,קיוויתי ש אקום הבוקר ל נאום ה ניצחון של ה נשיאה ה ראשונה של ארצות ה ברית,0,2
99,1,שמונה שנים לאחר ש נבחר ה נשיא ה שחור ה ראשון להוביל את ה עולם ה חופשי,0,2
99,2,איחלתי ל אנחנו ש נזכה לראות שחר של יום חדש,0,2
99,3,עידן ב הוא ה נשים מאתגרות ב יתר שאת את תקרת ה זכוכית,0,2
99,4,ה ציבור ה אמריקאי בחר ב ה מועמד ה רפובליקני דונלד טראמפ ו אני מכבדת את ה הכרעה ה דמוקרטית של אזרחי ו אזרחיות ארהב,1,0
99,5,ב ה שבוע ה אחרון מאות נשים עלו ל קברה של סוזן ב,0,2
99,6,פמיניסטית ו מ מובילות ה מאבק למען זכות הצבעה ל נשים,0,2
99,7,ה בחירות ל נשיאות ה שנה מתקיימות 144 שנים לאחר ש אנתוני נעצרה על כך ש הצביעה ל נשיאות ארהב ב ניגוד ל ה חוק דאז,0,2
99,8,אנתוני לא זכתה להגיע ל רגע ב הוא ה תיקון ה 19 ב ה חוקה ה אמריקאית הכיר בזכות ה נשים להצביע,0,2
99,9,פחות מ 100 שנה אחרי,0,2
99,10,מאות נשים ש מימשו את זכות הצבעתן עיטרו את קברה ב מדבקות ש עליהם רשום הצבעתי היום ו ציינו את ה מהפכה ה גדולה ש אנחנו עדיין ב שיאה,0,2
99,11,ה בחירות ה אלו היו ב חירות היסטוריות,1,0
99,12,מועמדת עמדה מול מועמד ו נאבקה למען כלל ה אזרחים ו ה אזרחיות,1,0
99,13,היא זעקה עבור אלו אשר ה מתמודד מול היא השמיץ ו פגע,1,-1
99,14,בין הם מ ה גרים,0,2
99,15,בעלי מוגבלויות ו בעיקר נשים,0,2
99,16,ה אגנדה ה פמיניסטית פועלת להיאבק למען זכויות כלל ה מיעוטים ו ה מודרים,0,2
99,17,ו מאמינה ב ה שוויון ל כל,0,2
99,18,קלינטון נתנה את מאבק חייה ו בתור אישה אין ספק ש היא שברה את תקרת ה זכוכית,0,2
99,19,זכותנו כ נשים להגיע ל קלפיות ו להצביע עבור עתידנו אינה מובנת מאל היא,0,2
99,20,כך גם זכותנו לחשוף הטרדות מיניות ו לזעוק על במות ציבוריות כי לא נכיל ביזוי ו השפלת נשים,0,2
99,21,מה הייתה אומרת סוזן ב,0,2
99,22,אנתוני אילו הייתה יודעת כי היום ב ה יכולתנו לעמוד ב ראש ה נהגת מדינות,0,2
99,23,דרך ארוכה עוד לפני אנחנו,0,2
99,24,אין ספק ש בחירתה של אישה ב ה פעם ה ראשונה ל נשיאות ארהב הייתה יכולה להיות רגע מכונן ב ה מהפכה ה פמיניסטית אך אני בטוחה ש נגיע ל כך ב עתיד,0,2
99,25,עצם ה התמודדות של אישה לעמוד ב ראש ה מעצמה ה עולמית הוא ניצחון,0,2
99,26,הוכחה נוספת ל כך ש ה מרחק בין אנחנו לבין שוויון מ גדרי מלא ב כל תחום מצטמצם מ יום ל יום ו מ שנה ל ה שנה,0,2
99,27,זה רק עניין של זמן,0,2
99,28,בינתיים אנו נמשיך להיאבק,0,2
